{
  "$schema": "./schemas/character_creation_rules.schema.json",
  "ruleset": "shadowrun5e.character-creation",
  "schema_version": 1,
  "edition": "Shadowrun Fifth Edition",
  "scope": "Core Rulebook priority-based character creation",
  "source": {
    "book_code": "CRB",
    "book_title": "Shadowrun, Fifth Edition Core Rulebook",
    "chapter": "Creating a Shadowrunner",
    "printed_pages": {
      "from": 62,
      "to": 107
    },
    "pdf_page_offset": 2,
    "notes": "Rules are paraphrased into executable facts. Page numbers are provenance metadata and are not presentation content."
  },
  "data_sources": {
    "priority_array": "priority_array.json#/priority_array",
    "play_levels": "priority_array.json#/play_levels",
    "metatypes": "metatypes.json#/metatypes",
    "attributes": "attributes.json#/attributes",
    "adept_powers": "adeptpowers.json#/powers",
    "skills": "skills.json#/skills",
    "qualities": "qualities.json",
    "matrix_actions": "matrixinteraction.json#/matrix_actions",
    "spirits": "spirits.json#/spirits",
    "equipment": "equipment.json",
    "weapons": "weapons.json",
    "lifestyles": "lifestyles.json#/lifestyles"
  },
  "workflow": [
    {
      "id": "concept",
      "order": 1,
      "mechanically_enforced": false,
      "source_pages": [
        62,
        63,
        64
      ]
    },
    {
      "id": "metatype-and-attributes",
      "order": 2,
      "mechanically_enforced": true,
      "source_pages": [
        65,
        66,
        67
      ]
    },
    {
      "id": "magic-or-resonance",
      "order": 3,
      "mechanically_enforced": true,
      "source_pages": [
        68,
        69,
        70,
        71
      ]
    },
    {
      "id": "qualities",
      "order": 4,
      "mechanically_enforced": true,
      "source_pages": [
        71,
        87
      ]
    },
    {
      "id": "skills",
      "order": 5,
      "mechanically_enforced": true,
      "source_pages": [
        88,
        92
      ]
    },
    {
      "id": "resources",
      "order": 6,
      "mechanically_enforced": true,
      "source_pages": [
        94,
        97
      ]
    },
    {
      "id": "leftover-karma-and-contacts",
      "order": 7,
      "mechanically_enforced": true,
      "source_pages": [
        98,
        99,
        105,
        106,
        107
      ]
    },
    {
      "id": "final-calculations",
      "order": 8,
      "mechanically_enforced": true,
      "source_pages": [
        100,
        101,
        102
      ]
    },
    {
      "id": "final-touches",
      "order": 9,
      "mechanically_enforced": false,
      "requires_gamemaster_approval": true,
      "source_pages": [
        103,
        104
      ]
    }
  ],
  "priority_system": {
    "ranks": [
      "A",
      "B",
      "C",
      "D",
      "E"
    ],
    "categories": [
      "metatype",
      "attributes",
      "magic_or_resonance",
      "skills",
      "resources"
    ],
    "assignment": "bijection",
    "rules": [
      {
        "id": "priority.complete",
        "assertion": "Every category has exactly one priority rank."
      },
      {
        "id": "priority.unique",
        "assertion": "Every rank A through E is used exactly once."
      },
      {
        "id": "priority.option-exists",
        "assertion": "The chosen metatype and Magic or Resonance path exist at their assigned ranks."
      }
    ],
    "source_pages": [
      65
    ]
  },
  "play_level_rules": {
    "level_ids": [
      "regular",
      "street_level",
      "prime_runner"
    ],
    "values_source": "priority_array.json#/play_levels",
    "resource_values_source": "priority_array.json#/priority_array/{rank}/resources/{play_level}",
    "positive_quality_karma_cap": {
      "op": "path",
      "path": "play_level.starting_karma"
    },
    "negative_quality_karma_cap": {
      "op": "subtract",
      "args": [
        {
          "op": "path",
          "path": "play_level.maximum_karma"
        },
        {
          "op": "path",
          "path": "play_level.starting_karma"
        }
      ]
    },
    "karma_to_nuyen_rate": 2000,
    "source_pages": [
      64,
      71,
      94,
      98
    ]
  },
  "attribute_rules": {
    "physical_and_mental": [
      "body",
      "agility",
      "reaction",
      "strength",
      "willpower",
      "logic",
      "intuition",
      "charisma"
    ],
    "special": [
      "edge",
      "magic",
      "resonance"
    ],
    "priority_point_cost_per_rating_increase": 1,
    "priority_points_must_be_spent": true,
    "priority_points_allowed_attributes": "physical_and_mental",
    "special_points_allowed_attributes": [
      "edge",
      "magic",
      "resonance"
    ],
    "special_points_may_be_unspent": true,
    "unspent_special_points_are_lost": true,
    "maximum_physical_or_mental_attributes_at_natural_limit": 1,
    "natural_minimums_and_limits_source": "metatypes.json#/metatypes/{metatype}/attributes",
    "magic_and_resonance_starting_rating": 0,
    "special_attribute_default_maximum": 6,
    "quality_limit_exceptions": {
      "exceptional-attribute": {
        "increase": 1,
        "allowed_targets": [
          "body",
          "agility",
          "reaction",
          "strength",
          "willpower",
          "logic",
          "intuition",
          "charisma",
          "magic",
          "resonance"
        ]
      },
      "lucky": {
        "increase": 1,
        "allowed_targets": [
          "edge"
        ]
      }
    },
    "source_pages": [
      65,
      66,
      67,
      98,
      101
    ]
  },
  "magic_paths": {
    "mundane": {
      "source_option": null,
      "required_priority": "E",
      "uses_special_attribute": null,
      "capabilities": {
        "magic_user": false,
        "technomancer": false,
        "can_astral_perceive": false,
        "can_astral_project": false,
        "leaves_astral_signature": false,
        "can_cast_spells": false
      },
      "allowed_magic_skill_groups": [],
      "allowed_resonance_skill_groups": [],
      "allowed_formula_categories": [],
      "may_bind_spirits": false,
      "may_register_sprites": false
    },
    "adept": {
      "source_option": "Adept",
      "uses_special_attribute": "magic",
      "capabilities": {
        "magic_user": true,
        "technomancer": false,
        "can_astral_perceive": false,
        "can_astral_project": false,
        "leaves_astral_signature": true,
        "can_cast_spells": false
      },
      "allowed_magic_skill_groups": [],
      "allowed_resonance_skill_groups": [],
      "allowed_formula_categories": [],
      "may_bind_spirits": false,
      "may_register_sprites": false,
      "free_power_points": {
        "op": "path",
        "path": "character.magic_rating"
      }
    },
    "magician": {
      "source_option": "Magician",
      "uses_special_attribute": "magic",
      "capabilities": {
        "magic_user": true,
        "technomancer": false,
        "can_astral_perceive": true,
        "can_astral_project": true,
        "leaves_astral_signature": true,
        "can_cast_spells": true
      },
      "allowed_magic_skill_groups": [
        "sorcery",
        "conjuring",
        "enchanting"
      ],
      "allowed_resonance_skill_groups": [],
      "allowed_formula_categories": [
        "spells",
        "rituals",
        "preparations"
      ],
      "may_bind_spirits": true,
      "may_register_sprites": false,
      "formula_limit_per_category": {
        "op": "multiply",
        "args": [
          {
            "op": "path",
            "path": "character.magic_rating"
          },
          2
        ]
      }
    },
    "aspected-magician": {
      "source_option": "Aspected Magician",
      "uses_special_attribute": "magic",
      "capabilities": {
        "magic_user": true,
        "technomancer": false,
        "can_astral_perceive": true,
        "can_astral_project": false,
        "leaves_astral_signature": true,
        "can_cast_spells": "only_when_sorcery_is_selected"
      },
      "allowed_magic_skill_groups": "one_selected_from:sorcery,conjuring,enchanting",
      "allowed_resonance_skill_groups": [],
      "allowed_formula_categories_by_selected_group": {
        "sorcery": [
          "spells",
          "rituals"
        ],
        "conjuring": [],
        "enchanting": [
          "preparations"
        ]
      },
      "may_bind_spirits_when_selected_group": "conjuring",
      "may_register_sprites": false,
      "formula_limit_per_category": {
        "op": "multiply",
        "args": [
          {
            "op": "path",
            "path": "character.magic_rating"
          },
          2
        ]
      }
    },
    "mystic-adept": {
      "source_option": "Mystic Adept",
      "uses_special_attribute": "magic",
      "capabilities": {
        "magic_user": true,
        "technomancer": false,
        "can_astral_perceive": "only_with_astral_perception_power",
        "can_astral_project": false,
        "leaves_astral_signature": true,
        "can_cast_spells": true
      },
      "allowed_magic_skill_groups": [
        "sorcery",
        "conjuring",
        "enchanting"
      ],
      "allowed_resonance_skill_groups": [],
      "allowed_formula_categories": [
        "spells",
        "rituals",
        "preparations"
      ],
      "may_bind_spirits": true,
      "may_register_sprites": false,
      "free_power_points": 0,
      "purchased_power_point_cost": 5,
      "maximum_purchased_power_points": {
        "op": "path",
        "path": "character.magic_rating"
      },
      "whole_power_points_only": true,
      "formula_limit_per_category": {
        "op": "multiply",
        "args": [
          {
            "op": "path",
            "path": "character.magic_rating"
          },
          2
        ]
      }
    },
    "technomancer": {
      "source_option": "Technomancer",
      "uses_special_attribute": "resonance",
      "capabilities": {